id,conversation_id,created_at,date,time,timezone,user_id,username,place,tweet,replies_count,retweets_count,likes_count,hashtags,near,geo,retweet_date
1163767350199537666,1163767346776956928,1566298732000,2019-08-20,06:58:52,EST,20680254,cr8tivecandy,,Please ask unions to stop advertising during the writ. They are all obviously NDP supporters and trying to influence voters.,2,0,1,[],Nova Scotia,,
1163574211769753600,1163574211769753600,1566252684000,2019-08-19,18:11:24,EST,716992774436990977,andrewhallcan,,"Elizabeth May and other politicians should get a grip - registering as a third party under the Elections Act is a nothingburger, and it allows you to spend more than$500 on paid advertising. I plan to register and put up posters telling my neighbours why they need to vote NDP.",0,0,0,[],Nova Scotia,,
1163541516977082374,1163541516977082374,1566244889000,2019-08-19,16:01:29,EST,70249254,dilemmanorton,,Check out this thread for some of the amazing NDP candidates running across Canada in this federal election! #NDP #CanPoli #Election2019 https://twitter.com/SaveWildBees/status/1163355640733011970 …,0,3,4,"['#ndp', '#canpoli', '#election2019']",Nova Scotia,,
1163090817260675078,1162704581329137664,1566137434000,2019-08-18,10:10:34,EST,975500192,harryt59_harry,,"Who is Tom Mulcair again? Never heard of him, just like after October we won't hear from the NDP  again.  You have become part of the conservative movement. Every NDP voter should come over to the liberals and let's fight together to keep Canada on the right track.  pic.twitter.com/CiP2rC1blm",0,2,3,[],Nova Scotia,,
1162660194712784896,1162659678989541377,1566034766000,2019-08-17,05:39:26,EST,187533340,monctonsjlawyer,,"The interim provincial NDP leader is a a 21 year old student. Good for him but the reality is that that means no organization and no ability to rally candidates. The feds rely on the provincial org. The Greens, Libs ans Tories can deliver to thir federal leader.",1,0,0,[],Nova Scotia,,
1162659678989541377,1162659678989541377,1566034643000,2019-08-17,05:37:23,EST,187533340,monctonsjlawyer,,"The federal NDP in NB have no candidates selected. Not one. They like the provincial NDP in NB need to to wrap it up and turn off the lights. There is no room left with Greens moving up. In NB the four provincial leaders, whether you like them or not, leave an impression  pic.twitter.com/OYgP54Jb7a",1,1,3,[],Nova Scotia,,
1162344827381538816,1162344827381538816,1565959576000,2019-08-16,08:46:16,EST,930146052019167232,ottawa_cameron,,Can the Ethics Committee also discuss how the CPC just broke election fundraising laws and how the NDP still owe taxpayers millions?  https://twitter.com/rachaiello/status/1162106564062449664 …,0,0,1,[],Nova Scotia,,
1161995661362913280,1161723605757001728,1565876329000,2019-08-15,09:38:49,EST,480138516,cathyspence3,,That's my man! To clarify; I was doubtful about Trudeau in the last election I voted NDP. I changed my mind; I like the decency of the man; I love watching him interacting with Canadians and he had done Canada proud on the world stage.,0,0,2,[],Nova Scotia,,
1161806830051450880,1161704128998977536,1565831308000,2019-08-14,21:08:28,EST,930146052019167232,ottawa_cameron,,I’d like the NDP to repay the millions they owe taxpayers. When will that happen?,0,0,0,[],Nova Scotia,,
1161805335268679680,1161805335268679680,1565830951000,2019-08-14,21:02:31,EST,930146052019167232,ottawa_cameron,,"I’ve reflected. The NDP ripped off millions from taxpayers and still haven’t paid it back. The CPC were found in contempt of Parliament, broke election laws, days ago broke fundraising laws and the PM’s CoS paid off a sitting Senator. Trudeau tried to save jobs. Quelle horreur.  https://twitter.com/Yukon_Strong/status/1161717084084158464 …",0,0,1,[],Nova Scotia,,
1161740043184168962,1161633426887368706,1565815385000,2019-08-14,16:43:05,EST,20720385,darrel_mac,,I was talking to Jamie from NDP HQ earlier this afternoon. He saw the post too and relayed to me that this picture is 2 years and that particular vehicle is not in the fleet of party vehicles anymore,4,2,6,[],Nova Scotia,,
1161735787706298371,1161735787706298371,1565814370000,2019-08-14,16:26:10,EST,713068172446928897,joe33224654,,NDP trying to blow smoke out their ass same as the CONS!  https://twitter.com/CBCPolitics/status/1161682047347253248 …,0,0,0,[],Nova Scotia,,
1161716389389852673,1161666077069381632,1565809745000,2019-08-14,15:09:05,EST,480138516,cathyspence3,,I don't agree; I voted NDP in the last federal election but I have been pleasantly surprised by Trudeau. Our economy is great; child tax credits helped a lot of families and unemployment is low but on the world stage we are getting rave reviews . Canada is in good shape.,4,1,4,[],Nova Scotia,,
1161392217560408064,1161351852962779139,1565732456000,2019-08-13,17:40:56,EST,67278150,ma_mchugh,,Just tweeting support here for an mp and a party #NDP2019  into helping real people and not  their corporate buddies. Go @nikiashton #NDP,0,0,1,"['#ndp2019', '#ndp']",Nova Scotia,,
1161078657512873984,1161078657512873984,1565657698000,2019-08-12,20:54:58,EST,144876537,bigjmcc,,Tell the #NDP which commitment will make the biggest impact on your life. #cdnpoli #canlab  https://ndp-npd.typeform.com/to/SVlrsx?guid=sm5Adm5gFIhceBocF09ECOA&ask=100&ytd=0&source=pre-election-survey&utm_medium=email&utm_source=newdemocrats&utm_content=2+-+Take+our+preelection+survey&utm_campaign=20190812_EML_SURVEY_3_READ_BSD_NDP_EN_ND … pic.twitter.com/ENfS45RK2j,0,0,0,"['#ndp', '#cdnpoli', '#canlab']",Nova Scotia,,
1160911949464346625,1160622258601132032,1565617952000,2019-08-12,09:52:32,EST,480138516,cathyspence3,,"I am also a life long progressive conservative;  I was a party worker; went to conventions, I was involved. But this conservative party represents everything I hate. Justin Trudeau was a pleasant surprise to me. Last time I voted NDP, this time I will vote Liberal.",1,0,4,[],Nova Scotia,,
1160908231713206272,1160908231713206272,1565617065000,2019-08-12,09:37:45,EST,144876537,bigjmcc,,#NDP #cdnpoli #canlab #Election2019 https://twitter.com/dilemmanorton/status/1160197833624104961 …,0,0,1,"['#ndp', '#cdnpoli', '#canlab', '#election2019']",Nova Scotia,,
1160817808575537153,1160619438804090880,1565595507000,2019-08-12,03:38:27,EST,67278150,ma_mchugh,,"Why not use your muscle to promote ndp who are promising full pharma.  And not this middle of the road stuff.  Party founded by you, not good enough now?  Recently retired from work and union, disappointed.",0,0,4,[],Nova Scotia,,
1160720551406686215,1160555350581379073,1565572319000,2019-08-11,21:11:59,EST,144876537,bigjmcc,,Go on with your #StrategicVoting voodoo. There are at least two other parties who will factor in to the balance of power in the next parliament. @ndp @CanadianGreens,0,0,3,['#strategicvoting'],Nova Scotia,,
1160573551289819138,1160573551289819138,1565537271000,2019-08-11,11:27:51,EST,67278150,ma_mchugh,,Next time #NDP #christineforhalifax https://twitter.com/queerthoughts/status/1160562220620800001 …,0,0,0,"['#ndp', '#christineforhalifax']",Nova Scotia,,
1160548689917677573,1160548689917677573,1565531344000,2019-08-11,09:49:04,EST,67278150,ma_mchugh,,Next time #NDP #christineforhalifax #emmanorton https://twitter.com/DianaDYoon/status/1160201991458566144 …,0,0,1,"['#ndp', '#christineforhalifax', '#emmanorton']",Nova Scotia,,
1160548012919332864,1160548012919332864,1565531182000,2019-08-11,09:46:22,EST,67278150,ma_mchugh,,Next time #NDP  http://chrstinesaulnier.ndp.ca  https://twitter.com/MichelleCohen12/status/1160335289874882560 …,0,0,2,['#ndp'],Nova Scotia,,
1159961053884796928,1159960335257915392,1565391240000,2019-08-09,18:54:00,EST,70249254,dilemmanorton,,Aha my eyes are closed!! Love you ☺,0,0,2,[],Nova Scotia,,
1159641088199729152,1159575220438667267,1565314955000,2019-08-08,21:42:35,EST,144876537,bigjmcc,,"Today, the CPP retirement benefit replaces about 25% of a Canadian’s average pre-retirement employment earnings. 

@CanadianLabour is asking the federal govt. to double CPP so that it replaces 50% of their earnings up to a maximum amount. #canlab #NDP #LPC https://canadianlabour.ca/uncategorized/enhancing-canada-pension-plan/ …",1,0,0,"['#canlab', '#ndp', '#lpc']",Nova Scotia,,
1159630143264055296,1159568414492336128,1565312345000,2019-08-08,20:59:05,EST,144876537,bigjmcc,,I’ve been saying for years now that ‘random selection’ of our elected officials would be a better alternative to what we currently have - career politicians who are mostly lawyers and wealthy businesspeople who have no idea what working people have to struggle with. #NDP #cdnpoli,0,0,1,"['#ndp', '#cdnpoli']",Nova Scotia,,
1157713439252504582,1157713439252504582,1564855367000,2019-08-03,14:02:47,EST,70249254,dilemmanorton,,"Pins are in! Grab one when you join @ChenderMLA, @susanleblancMLA  and the @NSNDP in the Natal Day Parade on Monday! Also check out the retro NDP lapel pin from the 1980s.  #PinsAreIn #NSpoli #NewDealforPeople #NDP  pic.twitter.com/MjLB6tl2ew",2,3,17,"['#pinsarein', '#nspoli', '#newdealforpeople', '#ndp']",Nova Scotia,,
1156892516303745024,1156638417368834050,1564659644000,2019-08-01,07:40:44,EST,845294413794496512,rosshaynes4,,Hanging on to her Government MLA Taxpayer funded payroll. This is Liberal Party leadership. #entitlment #NDP #Liberals #nspoli #canpoli,0,0,0,"['#entitlment', '#ndp', '#liberals', '#nspoli', '#canpoli']",Nova Scotia,,
1155933095511523328,1155875260467728391,1564430900000,2019-07-29,16:08:20,EST,1028408372671000577,lloydpmackay1,,"Hard to believe this as governing Liberals spent Millions settling old wrong doings or Billions!
Chief may not be up to date on what did happen when NDP said little or nothing! Why did Chief not run for Conservatives?",0,0,0,[],Nova Scotia,,
1155153503997825024,1155153503997825024,1564245031000,2019-07-27,12:30:31,EST,341240241,caf_goodness,,"@liberal_party, @CanadianGreens, @CPC_HQ, @NDP 

You'd all better get selling!  pic.twitter.com/mReX4DUK61",0,0,0,[],Nova Scotia,,
1155129708520071168,1154831717942943744,1564239358000,2019-07-27,10:55:58,EST,20680254,cr8tivecandy,,"Now, can we address that neoliberal strategies won’t work, a strong central plan and push are needed, which is the NDP’s forte, and yet you can’t see to get a camera on your leader to talk about it.",1,0,1,[],Nova Scotia,,
1155114701560438784,1154831717942943744,1564235780000,2019-07-27,09:56:20,EST,20680254,cr8tivecandy,,I am getting tired of not hearing solid positive vision from the NDP instead of  attacks on the least of their opponents. God I miss Jack Layton.,2,0,1,[],Nova Scotia,,
1155061285458972672,1154358722552127489,1564223045000,2019-07-27,06:24:05,EST,70249254,dilemmanorton,,Thank you Svend! That means a lot. I am glad to be on the team.,0,0,0,[],Nova Scotia,,
1154937559182712832,1154937559182712832,1564193546000,2019-07-26,22:12:26,EST,70249254,dilemmanorton,,Had a great night tonight with the two NDP candidates @jessikahepburn and @cmysaul. Hanging out with them put wind in my sails. They are incresibly impressive people with drive and vision for our future. #nspoli pic.twitter.com/KUjHSv2O6P,0,5,14,['#nspoli'],Nova Scotia,,
1154500938608107539,1154446818173829120,1564089448000,2019-07-25,17:17:28,EST,70249254,dilemmanorton,,Thank you for sharing!,0,0,0,[],Nova Scotia,,
1154446818173829120,1154446818173829120,1564076544000,2019-07-25,13:42:24,EST,144876537,bigjmcc,,#GreenNewDeal #DartmouthNS @GreenNewDealCa1 @ndp  https://twitter.com/dilemmanorton/status/1154358722552127489 …,1,1,4,"['#greennewdeal', '#dartmouthns']",Nova Scotia,,
1153858235125915648,1153794290344062977,1563936215000,2019-07-23,22:43:35,EST,70249254,dilemmanorton,,Thank you Keith!!,0,0,2,[],Nova Scotia,,
1153817072075284480,1153817072075284480,1563926401000,2019-07-23,20:00:01,EST,144876537,bigjmcc,,"Proud to march in the Bridgewater Ex parade with @jessikahepburn, federal @NDP candidate for South Shore-St. Margaret’s. @GaryBurrill pic.twitter.com/UTsAGqUfma",0,0,1,[],Nova Scotia,,
1153803242658156545,1153793691141603329,1563923104000,2019-07-23,19:05:04,EST,54725235,jessethomas21,,"“This community deserves a truly progressive candidate,” says Norton. “That’s what I feel I am...and this is a winnable riding for the NDP.” Big issues which she’s concerned about is the climate crisis and affordability.",0,0,1,[],Nova Scotia,,
1153802279176114176,1153793691141603329,1563922874000,2019-07-23,19:01:14,EST,54725235,jessethomas21,,Norton said she and Zaman remain on good terms and “it was unfortunate circumstances that were out of my control” re: Zaman‘s removal as candidate. Norton says she’s thrilled to have the opportunity to represent NDP in this riding of Dartmouth Cole Harbour.,1,0,0,[],Nova Scotia,,
1153796857316794368,1153793691141603329,1563921581000,2019-07-23,18:39:41,EST,54725235,jessethomas21,,"Zaman was here for the nomination meeting but didn’t speak. NDP Dartmouth Cole Harbour EDA president Nancy Bowes Offered an apology to her, saying she wished she had supported her better.",1,0,0,[],Nova Scotia,,
1153794290344062977,1153794290344062977,1563920969000,2019-07-23,18:29:29,EST,36988297,keiths462,South End Baptist Church,"So excited to watch my friend @dilemmanorton accept the @NDP nomination in #Dartmouth-#ColeHarbour! 

#nspoli #cdnpoli #elxn43 pic.twitter.com/iIQucnFhbj – at South End Baptist Church",1,6,26,"['#dartmouth', '#coleharbour', '#nspoli', '#cdnpoli', '#elxn43']",Nova Scotia,,
1153304109648351234,1153304109648351234,1563804101000,2019-07-22,10:01:41,EST,144876537,bigjmcc,,"Really @ElizabethMay? 

@AndrewScheer is in back pocket of #BigOil! 

@CanadianGreens @younggreenscan @ttrappenberg
#ClimateEmergency #cdnpoli #NDP  https://theenergymix.com/2019/07/22/green-party-splits-on-tar-sands-oil-sands-with-two-provincial-leaders-demanding-faster-phaseout/ … via @TheEnergyMix",0,0,0,"['#bigoil', '#climateemergency', '#cdnpoli', '#ndp']",Nova Scotia,,
1152512332423204865,1152512332423204865,1563615327000,2019-07-20,05:35:27,EST,67278150,ma_mchugh,,Have you seen the whole platform?  So impressed by the ndp this time. Don't let them tell you it can't be done!  https://twitter.com/theJagmeetSingh/status/1152256575698034688 …,0,2,2,[],Nova Scotia,,
1152384842274942978,1152339090152538112,1563584931000,2019-07-19,21:08:51,EST,12034642,davidakin,,"My aggregator — I know you hate them & your most recent poll is part of my data  — has CPC winning popular vote but LPC winning more seats. Three parties - NDP, BQ, GPC — flirting with official party status and yet any one of which could make LPC or CPC leader the PM. Wild.",3,2,3,[],Nova Scotia,,
1152006795306471424,1152006795306471424,1563494797000,2019-07-18,20:06:37,EST,144876537,bigjmcc,,#NDP #pharmacare #canlab https://twitter.com/TealePB/status/1151517655922180096 …,0,0,1,"['#ndp', '#pharmacare', '#canlab']",Nova Scotia,,
1151599379855396865,1151599379855396865,1563397662000,2019-07-17,17:07:42,EST,419593686,oneredcatmedia,,Well...this rules out my vote for the national NDP...  https://twitter.com/theJagmeetSingh/status/802734505920524289 …,0,0,2,[],Nova Scotia,,
1151281145528684548,1151281145528684548,1563321789000,2019-07-16,20:03:09,EST,144876537,bigjmcc,,#NDP #nspoli #cdnpoli #canlab #ClimateEmergency @EcologyAction @GreenNewDealCa1 https://twitter.com/dilemmanorton/status/1151258991659540480 …,0,1,1,"['#ndp', '#nspoli', '#cdnpoli', '#canlab', '#climateemergency']",Nova Scotia,,
1151260234561871873,1151260234561871873,1563316803000,2019-07-16,18:40:03,EST,36988297,keiths462,,Super excited to hear that @dilemmanorton will be seeking the @NDP nomination in #dartmouth #ColeHarbour! #nspoli #cdnpoli https://twitter.com/dilemmanorton/status/1151258991659540480 …,0,0,3,"['#dartmouth', '#coleharbour', '#nspoli', '#cdnpoli']",Nova Scotia,,
1150912289119322112,1150912289119322112,1563233847000,2019-07-15,19:37:27,EST,64740460,lisarobertshfx,,"My #stayconference is giving me a chance to connect with fabulous, insightful #ndp MLAs/MPPs from across Canada. #grateful  janet4burnaby @cfifekw monique_taylorndp #Halifax #cwphalifax2019 @ Province House  https://www.instagram.com/p/Bz9MLNKnirj/?igshid=1tu9xth3gbkio …",0,0,2,"['#stayconference', '#ndp', '#grateful', '#halifax', '#cwphalifax2019']",Nova Scotia,,
1150398718937636865,1149677136120340482,1563111402000,2019-07-14,09:36:42,EST,22027975,deadder,,"Editorial cartonoists are like opinion columnists. We give our views. We are not unbiased. I'm not telling the whole country to vote Green. I'm saying AC should elect a party who represents us. When Quebec elected all those NDPers, the NDP were forced to concentrate on Quebec.",1,0,3,[],Nova Scotia,,
1148640174945030144,1146467029597208578,1562692133000,2019-07-09,13:08:53,EST,144876537,bigjmcc,,"How is this different than the $1.7B @Bill_Morneau announced in his March, 2019 budget?  

Or are you simply re-announcing Cdn. govt. funding as campaign ‘promises’? #CDNPoli #LPC #nspoli #SSSM #Elections2019 #NDP @jessikahepburn @cmysaul @dilemmanorton https://mobilesyrup.com/2019/03/19/budget-2019-internet-rural-communities/ …",0,0,0,"['#cdnpoli', '#lpc', '#nspoli', '#sssm', '#elections2019', '#ndp']",Nova Scotia,,
1148579202104471552,1148254420834168832,1562677596000,2019-07-09,09:06:36,EST,800667728,mdnoncourt,,Quite a childish silly remark to date say : my father and grampy did not vote NDP so I cannot vote NDP ! Put your pants yourself for once Doucet!,0,0,1,[],Nova Scotia,,
1148359798267793408,1148347257642737664,1562625286000,2019-07-08,18:34:46,EST,930146052019167232,ottawa_cameron,,"The #NDP won 16 seats last election by 5% or less, and of those seats @sduvall07 won by only 2.4%. There’s a licensed #cannabis facility near his riding and maybe of his constituents work there too?",1,1,5,"['#ndp', '#cannabis']",Nova Scotia,,
1148348259708080133,1148347257642737664,1562622535000,2019-07-08,17:48:55,EST,930146052019167232,ottawa_cameron,,"What’s the breakdown of #cannabis facility by #cdnpoli party you ask? Well:

#LPC have 47 (44.8%)
#CPC have 39 (37.1%)
#NDP have 12 (11.4%)
#GPC have 2 (1.9%)
#BQ have  2 (1.9%)
Independent MPs have 3, one each.",1,4,13,"['#cannabis', '#cdnpoli', '#lpc', '#cpc', '#ndp', '#gpc', '#bq']",Nova Scotia,,
1144345068226191360,1142264039550148608,1561668099000,2019-06-27,16:41:39,EST,921040218907652096,mombot3k,,"Thank you @ranazamanNS. I appreciate your integrity, eagerness to learn and grow, and commitment to confronting bigotry and injustice. I'm one of your Jewish constituents, and one of your strongest supporters. So disappointed right now in @theJagmeetSingh and the @NDP.",2,2,4,[],Nova Scotia,,
1144287295522189314,1144287295522189314,1561654325000,2019-06-27,12:52:05,EST,921040218907652096,mombot3k,,"I've voted @NDP in every election, until now. @ranazamanNS works tirelessly to listen to constituents, encourage solidarity, and support the vulnerable. I'm one of a handful of Jewish residents in her riding and I utterly condemn this removal.",1,0,3,[],Nova Scotia,,
1143532305354502144,1143532305354502144,1561474322000,2019-06-25,10:52:02,EST,377061552,that_guy_jp182,,How about politians stop smear campaigning and tell us what YOU will do for us @Conservatives @liberal_party @NDP,0,0,0,[],Nova Scotia,,
1143500040696152064,1143500040696152064,1561466629000,2019-06-25,08:43:49,EST,776898590413352960,joshuahjeaton,,"Was @MaximeBernier right? This report from @NASA definitely should be considered as support for a @peoplespca government.

 https://www.nasa.gov/feature/goddard/2016/carbon-dioxide-fertilization-greening-earth …
#MadMax #ClimateChange #PPC2019 #carbontax 

Looks like the @liberal_party , @CPC_HQ , @NDP and @CanadianGreens are lying.",0,0,1,"['#madmax', '#climatechange', '#ppc2019', '#carbontax']",Nova Scotia,,
1142177645695836161,1142173310194606080,1561151346000,2019-06-21,17:09:06,EST,364657278,mhwal,,"Ontario: *elects Doug Ford*

Toronto: Well, WE didn’t vote for him.

NDP ridings in Edmonton and Calgary:  pic.twitter.com/ks38oHZMhs",0,0,42,[],Nova Scotia,,
1142174120903421952,1140572344899051525,1561150505000,2019-06-21,16:55:05,EST,776898590413352960,joshuahjeaton,,"Wow, it took you four days to come up with that response? It's no use pointing to all the countries where socialism has failed because people like you simply deny that it was never done right. It's never ever been done right in its entire history and it never will",0,0,0,[],Nova Scotia,,
1142093994459090944,1142093994459090944,1561131402000,2019-06-21,11:36:42,EST,144876537,bigjmcc,,#nlpoli #Labrador #BigLand #NDP @NLNDP @NLFL_labour https://twitter.com/KatieBreenNL/status/1142083163461697536 …,0,0,1,"['#nlpoli', '#labrador', '#bigland', '#ndp']",Nova Scotia,,
1141452419701837824,1141018452263604224,1560978438000,2019-06-19,17:07:18,EST,4739141603,michaelcrowel15,,He is a nutcase just like you. BTW while we are chatting his poll numbers are dismal and he is going to get crushed this October. You are welcome.,0,3,12,[],Nova Scotia,,
1141272758900469760,1141272758900469760,1560935604000,2019-06-19,05:13:24,EST,23772203,kempthead,,"The Sackville-Cobequid by-election results are devastating for @StephenMcNeil's Liberals, but also for @GaryBurrill 's NDP. In the face of a Liberal collapse, the Dip vote not only failed to rise, it fell by 5 points, and they lose their safest seat in the province  https://twitter.com/scoalegil/status/1141155199454797824 …",0,4,4,[],Nova Scotia,,
1141157837776785408,1141156328284545025,1560908204000,2019-06-18,21:36:44,EST,144876537,bigjmcc,,"NDP loses #SackvilleCobequid, a seat they’ve held for 34 years. 

I’d say it’s time to go back to the drawing board. @NSNDP #NDP #nslab #canlab @GaryBurrill #nspoli",2,1,2,"['#sackvillecobequid', '#ndp', '#nslab', '#canlab', '#nspoli']",Nova Scotia,,
1141143514027384833,1141116844331405312,1560904789000,2019-06-18,20:39:49,EST,209124972,ydentremont,Lower Sackville,NDP take another jump and this place is getting more crowded with excited supporters. Colleague @tarynalgrant confirmed advanced ballots will be the 40th poll. #nspoli pic.twitter.com/X6eqvgXrCv – at Lower Sackville,1,3,0,['#nspoli'],Nova Scotia,,
1141137303999586304,1141116844331405312,1560903309000,2019-06-18,20:15:09,EST,209124972,ydentremont,Lower Sackville,"Continues to be a pretty tight 2-way race between NDP and PC candidates. But with each little victory NDP folks cheer enthusiastically. “And our best polls still aren’t reporting. This is good,” NDP staffer says. #nspoli pic.twitter.com/QVLoZwrpDk – at Lower Sackville",2,0,3,['#nspoli'],Nova Scotia,,
1141132841796829184,1141130481209098241,1560902245000,2019-06-18,19:57:25,EST,1671360636,jeremy_keefe,,"8 Polls in and NDP Lara Fawthrop has taken the narrow lead now. Also, all parties are on the board.  pic.twitter.com/tM4rv3Trwn",1,2,0,[],Nova Scotia,,
1141116120528805889,1141111163897417735,1560898258000,2019-06-18,18:50:58,EST,1671360636,jeremy_keefe,,"In 2017 five candidates ran in the riding, marking the first time in its history the field was that large. 
NDP- 3,465
LIB- 2,038
PC- 1,991
GREEN- 262
ATLANTICA- 88",0,2,0,[],Nova Scotia,,
1141115252207181824,1141111163897417735,1560898051000,2019-06-18,18:47:31,EST,1671360636,jeremy_keefe,,"In 2013 NDP Dave Wilson hung onto his seat winning by less than 100 votes.
Dave Wilson - 2,983
Graham Cameron - 2,898",1,0,0,[],Nova Scotia,,
1141113435331203072,1141111163897417735,1560897618000,2019-06-18,18:40:18,EST,1671360636,jeremy_keefe,,"In 1988 15,020 people voted and the three parties all took reasonably similar shares.
NDP-5,430
LIB-4,816
PC-4,774",1,0,0,[],Nova Scotia,,
1140786235746729985,1140780100113371136,1560819608000,2019-06-17,21:00:08,EST,164333737,gw_parsons,,Stop with your big words and just tell everyone that the NDP is fucked.,0,0,0,[],Nova Scotia,,
1140737682450079746,1140737682450079746,1560808032000,2019-06-17,17:47:12,EST,447361732,marthpaynter,,"I’m at the #GreenNewDeal event in #Halifax with @cmysaul, our champion for climate justice!! @NDP @TheLeap_Org",0,0,10,"['#greennewdeal', '#halifax']",Nova Scotia,,
1140639257633202181,1140572344899051525,1560784565000,2019-06-17,11:16:05,EST,776898590413352960,joshuahjeaton,,I saw part of their plan when it was released by the CBC and it made me fear for the future of this great country. They're basically doing everything that economics 101 tells you what not to do,1,1,2,[],Nova Scotia,,
1140635340908171270,1140572344899051525,1560783631000,2019-06-17,11:00:31,EST,776898590413352960,joshuahjeaton,,Indeed socialism can be very droll. Nobody wants a bleak outlook for the Canadian future.,1,0,0,[],Nova Scotia,,
1140589574386790400,1140572344899051525,1560772720000,2019-06-17,07:58:40,EST,776898590413352960,joshuahjeaton,,*woosh* did ya hear that? It was the joke flying over your head at warp speed....,0,0,0,[],Nova Scotia,,
1140572344899051525,1140572344899051525,1560768612000,2019-06-17,06:50:12,EST,776898590413352960,joshuahjeaton,,"Ran the @NDP plan through an economic simulator. Here is the result

#PPC2019 #madmax
@theJagmeetSingh will destroy Canada with his #Socialist agenda. Vote for @MaximeBernier and support @peoplespca if you want a strong and vibrant #Canada pic.twitter.com/Q002jLoTxC",1,12,31,"['#ppc2019', '#madmax', '#socialist', '#canada']",Nova Scotia,,
1140344896248844288,1140344896248844288,1560714384000,2019-06-16,15:46:24,EST,628088895,paige_farah,,Is @theJagmeetSingh getting his groove back? I hope so! #NewDealforPeople #NDP @NDPHoC_NPDCdC https://twitter.com/HannahThibedeau/status/1140287760399577088 …,0,0,0,"['#newdealforpeople', '#ndp']",Nova Scotia,,
